{
  "schemaVersion": 1,
  "generator": {
    "name": "AdoToolkit",
    "version": "2.1.0-test"
  },
  "generatedAt": "2026-09-15T10:30:00-03:00",
  "culture": "en-US",
  "collectionUrl": "https://ado.example.test/tfs/Collection%20A/",
  "project": "\u00C9quipe / Web?#",
  "source": "TestCase",
  "cases": [
    {
      "id": 10,
      "rev": 3,
      "title": "Synthetic case \u003Ctitle\u003E",
      "workItemType": "Cas personnalis\u00E9",
      "state": "Ready",
      "serverUrl": "https://ado.example.test/",
      "collectionUrl": "https://ado.example.test/tfs/Collection%20A/",
      "project": "\u00C9quipe / Web?#",
      "changedDate": "2026-09-13T10:30:00-03:00",
      "retrievedAt": "2026-09-15T10:29:00-03:00",
      "webUrl": "https://ado.example.test/tfs/Collection%20A/%C3%89quipe%20%2F%20Web%3F%23/_workitems/edit/10",
      "status": "Partial",
      "stepCount": 1,
      "rows": [
        {
          "number": "1",
          "sequence": 1,
          "kind": "Action",
          "action": "Enter @user",
          "expectedResult": "",
          "isExpanded": false,
          "sourceWorkItemId": 10,
          "sourceRev": 3,
          "sourceStepId": 11,
          "depth": 0,
          "sharedStepPath": []
        },
        {
          "number": "2",
          "sequence": 2,
          "kind": "SharedStep",
          "action": "",
          "expectedResult": "",
          "sharedStep": {
            "id": 99,
            "referenceCount": 1
          },
          "isExpanded": false,
          "sourceWorkItemId": 10,
          "sourceRev": 3,
          "depth": 0,
          "diagnosticCode": "UnresolvedSharedStep",
          "diagnosticMessage": "The referenced shared steps are missing or inaccessible.",
          "sharedStepPath": []
        },
        {
          "number": "3",
          "sequence": 3,
          "kind": "Truncated",
          "action": "",
          "expectedResult": "",
          "isExpanded": false,
          "sourceWorkItemId": 10,
          "sourceRev": 3,
          "depth": 0,
          "diagnosticCode": "ExpansionLimitExceeded",
          "diagnosticMessage": "The expanded step limit was exceeded; expansion stopped.",
          "sharedStepPath": []
        }
      ],
      "sharedSteps": [
        {
          "id": 99,
          "referenceCount": 1
        }
      ],
      "parameters": {
        "source": "None",
        "names": [],
        "rows": [],
        "sharedParameterSets": []
      },
      "diagnosticsSummary": {
        "errorCount": 3,
        "warningCount": 0,
        "informationCount": 0
      },
      "diagnostics": [
        {
          "code": "UnresolvedSharedStep",
          "severity": "Error",
          "arguments": [],
          "message": "The referenced shared steps are missing or inaccessible.",
          "workItemId": 10,
          "stepNumber": "2",
          "referenceChain": [
            10,
            99
          ]
        },
        {
          "code": "ExpansionLimitExceeded",
          "severity": "Error",
          "arguments": [],
          "message": "The expanded step limit was exceeded; expansion stopped.",
          "workItemId": 10,
          "stepNumber": "3",
          "referenceChain": [
            10,
            99
          ]
        },
        {
          "code": "MalformedStepsXml",
          "severity": "Error",
          "arguments": [
            "7",
            "19"
          ],
          "message": "Steps XML is invalid at line 7, position 19.",
          "workItemId": 99,
          "referenceChain": []
        }
      ]
    }
  ]
}